title,score,upvote_ratio,num_comments,author,subreddit,url,permalink,created_utc,is_self,selftext,flair,domain,search_query
Meditators should be proud of themselves,96,0.94,27,Euphoric-Welder5889,Mindfulness,https://www.reddit.com/r/Mindfulness/comments/1lef9o9/meditators_should_be_proud_of_themselves/,https://www.reddit.com/r/Mindfulness/comments/1lef9o9/meditators_should_be_proud_of_themselves/,1750248084,True,"Sitting with eyes closed for even 20 minutes is something most people cannot do. I think you need to give yourself enormous credit for sitting and working on yourself with tools like meditation. Meditation is something that can really enhance who you are. Some people become doctors, lawyers, engineers. And then some people choose to sit and work on themselves with yoga and meditation. That should really be recognised as an achievement in itself. Be proud of yourself. ",Insight,www.reddit.com,meditation
"i’ll be moving across the country in less than a month. this yard is where i started meditating daily, and i will miss it most of all. i became a tree here 🌳",1204,0.99,33,highups,Mindfulness,https://www.reddit.com/gallery/r5m0mo,https://www.reddit.com/r/Mindfulness/comments/r5m0mo/ill_be_moving_across_the_country_in_less_than_a/,1638274543,False,,,www.reddit.com,meditation
What to focus on besides my breath when meditating?,16,0.92,15,DisIshSucks,Mindfulness,https://www.reddit.com/r/Mindfulness/comments/1obwh5b/what_to_focus_on_besides_my_breath_when_meditating/,https://www.reddit.com/r/Mindfulness/comments/1obwh5b/what_to_focus_on_besides_my_breath_when_meditating/,1761000778,True,"I cannot focus on my breath during meditation because then breathing becomes an involuntary action that makes me think about my breath over clearing my mind of distractions. I’m curious if this is common and what other people focus on. 

So far, the best thing that works for me is focusing on the center point in the darkness of my closed eyes. I guess it’s not always dark like when you close your eyes when it’s sunny out and you actually still see the flashes of color all over. 
But I just stay ",Question,www.reddit.com,meditation
Meditated for 44 days in a row ,326,0.98,30,InfamousFisherman573,Mindfulness,https://i.redd.it/k9wqnrrbk7pd1.jpeg,https://www.reddit.com/r/Mindfulness/comments/1fiawl2/meditated_for_44_days_in_a_row/,1726508547,False,"I've been kinda nervous and intense my whole life and always wanted to try meditating, it's been hard for me keeping a consistent schedule, but I managed to do it for 44 days!! I'm super proud of myself.

I used an app called Mainspring habit tracker which reminded me to meditate and kept me motivated with nice stats and graphs - this is usually not enough for me, but I pushed myself to do it and I think without this app I couldn't find the motivation I was looking for.

For anyone wondering, I ",Photo,i.redd.it,meditation
Meditation for mental health,33,0.94,14,Euphoric-Welder5889,Mindfulness,https://www.reddit.com/r/Mindfulness/comments/1nr3ee3/meditation_for_mental_health/,https://www.reddit.com/r/Mindfulness/comments/1nr3ee3/meditation_for_mental_health/,1758898278,True,"I have this friend who is suffering from a mental illness. He has many delusions where he thinks things are harming him. He believes someone planted a chip in his brain to control him and perform experiments on him. He has delusions that the neighbours are banging on the walls and transferring bad things onto him using “technology”. 

I thought about how to help him, but there is no way of talking him out of this state of mind. Then I suggested that he should try a meditation. I asked him to dow",Question,www.reddit.com,meditation
I mentioned I feel awkward meditating and my wife made some cool art.,1081,0.99,40,RidingTheSpiral1977,Mindfulness,https://i.redd.it/x3bs3z6n75m61.jpg,https://www.reddit.com/r/Mindfulness/comments/m1r0c2/i_mentioned_i_feel_awkward_meditating_and_my_wife/,1615356821,False,,,i.redd.it,meditation
Is Mindfulness Meditation Suitable for All?,1,0.57,23,Jessibrowny,Mindfulness,https://www.reddit.com/r/Mindfulness/comments/1mypph8/is_mindfulness_meditation_suitable_for_all/,https://www.reddit.com/r/Mindfulness/comments/1mypph8/is_mindfulness_meditation_suitable_for_all/,1756022316,True,"
We frequently hear that the ""magic cure"" for anxiety and stress is meditation. Advice abounds: 

""Your life will change if you practice mindfulness every day."" 
The reality, however, is far more nuanced than that polished façade. 
After months of regular practice, some people actually experience calmer, more focused attention and improved emotional control. 
Others see little to no change. Unexpectedly, some people also report negative effects, such as elevated anxiety, the recurrence of past t",Resources,www.reddit.com,meditation
This goes for mindfulness meditation as well :),1383,0.99,16,JayBeeAllen,Mindfulness,https://i.redd.it/oazzezjjrsd91.jpg,https://www.reddit.com/r/Mindfulness/comments/wqbwnp/this_goes_for_mindfulness_meditation_as_well/,1660700219,False,,,i.redd.it,meditation
An illustrated guide to mindfulness meditation,422,0.99,20,wisdomperception,Mindfulness,https://i.redd.it/nwwrlbsy7eod1.jpeg,https://www.reddit.com/r/Mindfulness/comments/1ff512i/an_illustrated_guide_to_mindfulness_meditation/,1726154132,False,,Photo,i.redd.it,meditation
Meditation is wild when you think about it,26,0.87,17,ConsciousAdam,Mindfulness,https://www.reddit.com/r/Mindfulness/comments/1n7p2zz/meditation_is_wild_when_you_think_about_it/,https://www.reddit.com/r/Mindfulness/comments/1n7p2zz/meditation_is_wild_when_you_think_about_it/,1756929224,True,"Meditation is wild when you think about it…
You're just sitting there, doing absolutely nothing…
…except fighting your inner demons, replaying every awkward moment since 2007, trying to focus on your breath while your brain reminds you of that one time you waved back at someone who wasn’t waving at you.

But somehow...

In between all that chaos,
there’s this tiny space of silence.
That space between the thoughts - which at first feels so alien, so unfamiliar, even terrifying...
And that’s the p",Creative,www.reddit.com,meditation
Why I meditate,999,0.98,33,humxnprinter,Mindfulness,https://i.redd.it/3be0djiodp981.jpg,https://www.reddit.com/r/Mindfulness/comments/rvz8rt/why_i_meditate/,1641316017,False,,,i.redd.it,meditation
Remember to practice of being present in the moment even after the meditation session,1204,0.97,32,robyviggy,Mindfulness,https://i.redd.it/zsd2gvq4w6q61.jpg,https://www.reddit.com/r/Mindfulness/comments/mgjhwf/remember_to_practice_of_being_present_in_the/,1617120550,False,,,i.redd.it,meditation
Meditation starts to work when I really start to feel what I feel,33,0.96,8,AdeptJuggernaut4607,Mindfulness,https://www.reddit.com/r/Mindfulness/comments/1ob05q5/meditation_starts_to_work_when_i_really_start_to/,https://www.reddit.com/r/Mindfulness/comments/1ob05q5/meditation_starts_to_work_when_i_really_start_to/,1760905612,True,"For years I have been meditating, it was mostly like observing my breaths and if I notice something in my head, notice it and come back to the breathing. It was great exercises to try to calm my mind and focus on something else, but I feel like it doesn't really address the root of the 'problem', it wasn't really a problem, but it's just a surface levelling of work. 

I feel that things start to shift when I learn more about I'm not my thoughts. I can have any thoughts in my head like I'm the wo",Insight,www.reddit.com,meditation
Meditators Forget This All The Time,31,0.82,16,MindfulnessForHumans,Mindfulness,https://www.reddit.com/r/Mindfulness/comments/1mz824q/meditators_forget_this_all_the_time/,https://www.reddit.com/r/Mindfulness/comments/1mz824q/meditators_forget_this_all_the_time/,1756070899,True,"Mindfulness is NOT about controlling or changing your thoughts. It's not about creating some kind of experience for yourself. It's about BEING with *whatever* is arising in the here and now. 

In our lives we constantly expect results, expect *progress*. But in this discipline, the notion of a **result** takes us farther away from THIS moment. Strict goals take away our freedom to BE complete in the here and now.

What's another important insight that a lot of meditators need to hear, but often ",Insight,www.reddit.com,meditation
What was the longest meditation you have ever done?,8,1.0,16,QuietLifeInLoudWorld,Mindfulness,https://www.reddit.com/r/Mindfulness/comments/1nez96a/what_was_the_longest_meditation_you_have_ever_done/,https://www.reddit.com/r/Mindfulness/comments/1nez96a/what_was_the_longest_meditation_you_have_ever_done/,1757671733,True,"I am really curious about how you perceive the effect of meditation's length on the overall experience and on the benefits. Whether you are meditating for spiritual purposes or for well-being purposes, I really want to hear your experiences.
Edit: I mean sitting meditation session.",Question,www.reddit.com,meditation
Do You Have a Meditation Style That Doesn’t Look Like Meditation?,18,0.96,13,cakamaa,Mindfulness,https://www.reddit.com/r/Mindfulness/comments/1nkfbm3/do_you_have_a_meditation_style_that_doesnt_look/,https://www.reddit.com/r/Mindfulness/comments/1nkfbm3/do_you_have_a_meditation_style_that_doesnt_look/,1758218049,True,"I used to think meditation was some ritual for certain religions,  so I never cared to know what it was.

But when I grew older, with responsibilities, dreams to chase, and challenges to face, that’s when I felt how much my mind needed peace.

At first, I didn’t call it meditation.

One morning I woke up feeling heavy and scattered. My thoughts everywhere, no energy to start my day.

So I went for a walk.

On the way, I came across a river with trees all around and the air was so calm and cool. ",Insight,www.reddit.com,meditation
The Best Explanation of the Difference Between Concentration Meditation vs Mindfulness Meditation?,42,0.94,19,andtitov,Mindfulness,https://i.redd.it/4tfnhb9xc1ef1.png,https://www.reddit.com/r/Mindfulness/comments/1m4ppi5/the_best_explanation_of_the_difference_between/,1753020199,False,"Is it the best explanation of the difference between concentration meditation vs mindfulness meditation? If you saw better, please share the link. Thanks!",Question,i.redd.it,meditation
"Why does meditation have to be so damn boring? I was bored so I got a board. Balance split focus, which with practice strengthens it. Focus improves concentration to inhabit the present which is mindfulness active meditation.",537,0.9,74,sdraz,Mindfulness,https://i.redd.it/aah0t72yqgh61.jpg,https://www.reddit.com/r/Mindfulness/comments/ljqmga/why_does_meditation_have_to_be_so_damn_boring_i/,1613317251,False,,,i.redd.it,meditation
Anyone else have a cat that practices meditation with you every morning? :),978,0.97,36,meglikegg,Mindfulness,https://i.redd.it/4n2p542y3o171.jpg,https://www.reddit.com/r/Mindfulness/comments/nm7var/anyone_else_have_a_cat_that_practices_meditation/,1622123339,False,,,i.redd.it,meditation
Has anyone else done a “color walk” when meditation feels flat?,22,0.93,7,MusicUnique5496,Mindfulness,https://www.reddit.com/r/Mindfulness/comments/1o2940j/has_anyone_else_done_a_color_walk_when_meditation/,https://www.reddit.com/r/Mindfulness/comments/1o2940j/has_anyone_else_done_a_color_walk_when_meditation/,1760023964,True,"I’ve been bouncing around in my head lately, doing meditations, yoga, all that, but lately everything’s felt kind of dry. Someone mentioned a “color walk” and I tried it last night, and it was weird in a good way.

I chose teal (because I was in a moody mood), and for 10 minutes I just walked, and every time I saw something teal I’d pause and take it in. A teal car, a teal door frame, a scratched painted spot. My mind kept trying to drift, but I’d pull it back to “okay, teal again.” It felt like",Question,www.reddit.com,meditation
"Mindfulness of transformation (e.g. using meditation) cannot be effective without mindfulness of consumption. The former reduces symptoms, the latter removes the root of suffering altogether!",915,0.98,49,Ur_Inner_Pwr,Mindfulness,https://i.redd.it/1u4pgh6e5nk41.jpg,https://www.reddit.com/r/Mindfulness/comments/fdbnc4/mindfulness_of_transformation_eg_using_meditation/,1583321226,False,,,i.redd.it,meditation
Mindfulness meditation increasing stress,3,0.6,16,Blaise_89,Mindfulness,https://i.redd.it/dzc01cpeabmf1.jpeg,https://www.reddit.com/r/Mindfulness/comments/1n4ozk4/mindfulness_meditation_increasing_stress/,1756627154,False,"I regularly meditate for 30 to 60 minutes by either focusing on my breath or on the sensation of throat tightness the sensation of stress. 
Interestingly, my fitness tracker whoop says my meditation practice usually increases my stress level. Should I stop meditating?",Question,i.redd.it,meditation
Has anyone else accidentally started to meditate and found it life changing?,102,0.96,15,Euphoric-Welder5889,Mindfulness,https://www.reddit.com/r/Mindfulness/comments/1lajcd3/has_anyone_else_accidentally_started_to_meditate/,https://www.reddit.com/r/Mindfulness/comments/1lajcd3/has_anyone_else_accidentally_started_to_meditate/,1749829723,True,"A few years ago I worked a full time sales job in London. I was stressed and sometimes I would have issues falling asleep. I would be anxious and have chest cramps. 

But then one night when I was laying in bed and having an anxiety attack I remembered something I learned in a mindfulness course my mom had made me take a few years back. It was a big shift. I just surrendered to the present moment. I learned to just watch all the bodily sensations, but I watched it from a distance. A profound sen",Insight,www.reddit.com,meditation
Do not try to stop thoughts when you meditate,175,0.98,27,Euphoric-Welder5889,Mindfulness,https://www.reddit.com/r/Mindfulness/comments/1hhup05/do_not_try_to_stop_thoughts_when_you_meditate/,https://www.reddit.com/r/Mindfulness/comments/1hhup05/do_not_try_to_stop_thoughts_when_you_meditate/,1734620300,True,"It’s simply pointless to try to stop or change any thoughts or feeling you have when you meditate. If you try you will only produce more thoughts. As Sadh-guru said, the mind is like a car that has 3 pedals which are all accelerators. There are no breaks when it comes to the mind. Whichever pedal you press you will only create more thinking. Try this as an experiment to forcefully make yourself not think of a monkey. You will find that it is impossible. Whatever you try to avoid becomes the basi",Insight,www.reddit.com,meditation
How Meditation Helped Me Understand My Anxiety (Instead of Fighting It),30,0.92,8,Jealous_Helicopter84,Mindfulness,https://www.reddit.com/r/Mindfulness/comments/1nr79u9/how_meditation_helped_me_understand_my_anxiety/,https://www.reddit.com/r/Mindfulness/comments/1nr79u9/how_meditation_helped_me_understand_my_anxiety/,1758907212,True,"

A few months ago I was that person who tried meditation for like 3 days, got frustrated because my mind wouldn’t shut up, and gave up thinking it wasn’t for me. Then my therapist asked me something that changed everything: “What if instead of trying to silence your anxiety, you actually listened to what it’s trying to tell you?”

That question led me down a path where meditation became less about achieving some zen state and more about becoming curious about my own mind. Wanted to share what I",Advice,www.reddit.com,meditation
How can neat handwriting be meditative,1240,0.99,22,suck-me-beautiful,Mindfulness,https://i.imgur.com/SrRigPd.gifv,https://www.reddit.com/r/Mindfulness/comments/n71amk/how_can_neat_handwriting_be_meditative/,1620401694,False,,,i.imgur.com,meditation
"You should sit in meditation for 20 minutes a day, unless you’re too busy. Then you should sit for an hour.",782,0.98,56,Say_Less_Listen_More,Mindfulness,https://www.reddit.com/r/Mindfulness/comments/et45wj/you_should_sit_in_meditation_for_20_minutes_a_day/,https://www.reddit.com/r/Mindfulness/comments/et45wj/you_should_sit_in_meditation_for_20_minutes_a_day/,1579834453,True,"This is one my favorite adages to think of when I feel too tired or like I don't have time for meditation, yoga, etc.

Mind you this is not meant to scold, but to remind us that perhaps those times when we feel we're too busy for our mindfulness practice are when we need it most.",,www.reddit.com,meditation
7 lessons from 7 years of meditation.,40,0.98,9,Confident_Device_865,Mindfulness,https://www.reddit.com/r/Mindfulness/comments/1nbu7m8/7_lessons_from_7_years_of_meditation/,https://www.reddit.com/r/Mindfulness/comments/1nbu7m8/7_lessons_from_7_years_of_meditation/,1757352823,True,"Hi, new to Reddit... hopefully this is the right place to be posting this.

I’ve been meditating semi-consistently for over 7 years now, so I’d thought I’d share 7 lessons I’ve learnt from 7 years of meditation.



**1. Start simple.**

The periods of my life when I’ve been most consistent have been when I’ve returned to a super simple practice (maybe just 5 minutes a day) and built back up over time.



**2. Some days are easier than others.**

Some days you wake up refreshed, mind sharp, ready",Advice,www.reddit.com,meditation
"Sick of people with good mental health telling me to ""just get help""",526,0.99,135,AmericanDesertWitch,depression,https://www.reddit.com/r/depression/comments/1llxent/sick_of_people_with_good_mental_health_telling_me/,https://www.reddit.com/r/depression/comments/1llxent/sick_of_people_with_good_mental_health_telling_me/,1751039622,True,"""If you're feeling suicidal call someone""

""If your mental health sucks go see a therapist""

""You might need medication, probably best you see a psychiatrist""

Yeah. Because it is so easy. Finding a provider, making sure they are in network with your insurance, calling them, making an appointment as a new patient, getting access to THEIR portal, filling out a bunch of forms and then wait for a call back, only to finally 2 weeks later get a 6am appointment, and but then THEY DON'T SHOW UP. And yo",,www.reddit.com,mental health
Everybody gangsta about mental health til you're outwardly depressed ,897,1.0,122,Grxmloid,depression,https://www.reddit.com/r/depression/comments/1hbhxzp/everybody_gangsta_about_mental_health_til_youre/,https://www.reddit.com/r/depression/comments/1hbhxzp/everybody_gangsta_about_mental_health_til_youre/,1733880208,True,"Light depression, light anxiety... these are ok. But clinical depression, being vocal and honest, even frustrated about it... Too confronting. Not to mention obviously the same goes for bipolar etc. 

People who previously think they're understanding and empathetic bc their own battles, but they stay silent. They get awkward. This species is doomed when it comes to catching our emotional intelligence up with technological evolution.

Not many seem to be able to tolerate when someone is feeling l",,www.reddit.com,mental health
It sucks how mental health is never a valid excuse in college,2690,0.99,114,stlvng2,depression,https://www.reddit.com/r/depression/comments/ipgaqf/it_sucks_how_mental_health_is_never_a_valid/,https://www.reddit.com/r/depression/comments/ipgaqf/it_sucks_how_mental_health_is_never_a_valid/,1599659632,True,"*CW* 

anywhere, really, work/jobs included. I can't keep track of my lies. My ""headaches"" and ""migraines"" and ""feeling sick"" are all lies. I can't keep track of them. I wish instead of saying ""I stayed home because of my headache"" I could say the truth ""I have no motivation or energy. I want to kill myself. I hate myself so much and I want to die. I can't even drink water or eat healthy. I can't even do my work. I want to kill myself"".",,www.reddit.com,mental health
When your mental health is so bad it physically feels painful.,199,1.0,56,theacebutterfly,depression,https://www.reddit.com/r/depression/comments/1mi5nyc/when_your_mental_health_is_so_bad_it_physically/,https://www.reddit.com/r/depression/comments/1mi5nyc/when_your_mental_health_is_so_bad_it_physically/,1754390210,True,"Does anyone else experience this? End my suffering, I beg you",,www.reddit.com,mental health
Yesterday I finally went to the doctors to speak about my mental health!!!!,956,0.99,132,whatstheweatherlike2,depression,https://www.reddit.com/r/depression/comments/cedl6i/yesterday_i_finally_went_to_the_doctors_to_speak/,https://www.reddit.com/r/depression/comments/cedl6i/yesterday_i_finally_went_to_the_doctors_to_speak/,1563373770,True,"He has diagnosed me with depression and given me anti depressants. Also recommended seeing a counselor. Furthermore, I went back to play hockey last night for the first time in 5 years. After a year of feeling awful, I am ready to turn it around.

Edit: thanks very much to everybody who commented such thoughtful, positive and kind comments. Also thanks for the advice throughout too. The response made me feel so happy and like I'd really taken a big step. Also thank you to the very kind person wh",,www.reddit.com,mental health
My religious parents won’t let me get any sort of mental health treatment,820,0.99,112,sewer_rat0,depression,https://www.reddit.com/r/depression/comments/kcbaxe/my_religious_parents_wont_let_me_get_any_sort_of/,https://www.reddit.com/r/depression/comments/kcbaxe/my_religious_parents_wont_let_me_get_any_sort_of/,1607868968,True,"I’ve been trying to convince my parents to get some sort of treatment for my depression for so long but they keep telling me to “just pray” and talk to my youth group leaders about it (I’m not comfortable doing that bc I have social anxiety). My doctor first strongly suggested getting help for my depression and anxiety when I first started 6th grade (I’m in 9th now) and she keeps pushing for it and my parents still won’t budge. I’ve literally stood in front of them sobbing, begging for any profe",,www.reddit.com,mental health
Let's break the mental health stigma (throwaway account) - upvotes for visibility and awareness on an issue noone wants to talk about. So share your story.,591,0.97,300,loveurcrazy,depression,https://www.reddit.com/r/depression/comments/18yy5u/lets_break_the_mental_health_stigma_throwaway/,https://www.reddit.com/r/depression/comments/18yy5u/lets_break_the_mental_health_stigma_throwaway/,1361474477,True,"I am mentally ill and I am not a bad person because of it. I am not useless. I am worth more then a bed in a hospital and a prescription. I am capable. I am worth getting a job. Getting a degree. Falling in love and starting a family - no matter what society and the media may try and tell me.

Please share your story - 

A moment where you saw someone being harassed for being mentally ill and how you stepped it

A moment you were discriminated or a friend/family member/loved one was discriminate",,www.reddit.com,mental health
I’m a deeply depressed mental health professional. Does that make me a hypocrite?,686,0.99,124,booger319,depression,https://www.reddit.com/r/depression/comments/d5d5lq/im_a_deeply_depressed_mental_health_professional/,https://www.reddit.com/r/depression/comments/d5d5lq/im_a_deeply_depressed_mental_health_professional/,1568702384,True,"I am a mental health counselor and student pursuing a Masters degree in Social Work to become a therapist.

I spend all day helping those who are depressed, suicidal, self-harming, anxious, but I can’t seem to apply any of the coping skills to myself.

I’m so depressed. I cry all the time over the smallest things. I daydream of relapsing back into cutting, even though I’m 3.5 years clean. I’m so anxious all the time. I want to die but I’m not actively trying to kill myself. One of the reasons wh",,www.reddit.com,mental health
New therapist told me “I don’t think you fit in the mental health help because your depression is based on reasons and not mental” I feel like I can’t get any help anymore ,104,0.97,58,Confident-Mine-6378,depression,https://www.reddit.com/r/depression/comments/1hu8l5x/new_therapist_told_me_i_dont_think_you_fit_in_the/,https://www.reddit.com/r/depression/comments/1hu8l5x/new_therapist_told_me_i_dont_think_you_fit_in_the/,1736088558,True,"It’s my 4th therapist i’m starting to see.
1st never remembered anything from previous meetings so each meeting repeated itself.
2nd was a social worker and mostly tried to tell me that everything was ok and mostly just asked about my day to day, it was less beneficial than talking to a friend.
3rd wasn’t helpful as well and mostly was sorry for my life telling stuff like “life isn’t really fair uh” or “it makes me sad what you tell me”

I’m on my 2nd type of antidepressants, had to change the f",,www.reddit.com,mental health
I [M29] am foreigner living for 4 years in London without any new friends/girlfriend around my age. Tried Tinder/Okcupid/Instagram - still alone and lonely + started working from home - my mental health is getting worse - long post,736,0.97,74,1234trashaccount,depression,https://www.reddit.com/r/depression/comments/kcay94/i_m29_am_foreigner_living_for_4_years_in_london/,https://www.reddit.com/r/depression/comments/kcay94/i_m29_am_foreigner_living_for_4_years_in_london/,1607867566,True,"Hi Reddit, I need to share something... 

**About me:**

I'm turning 29 at the beginning of 2021. I've moved to UK for studies and for a better life, so I'm not planning to go back to my home country. English is also not my native language. I'm working in a large global company making above 3000£ per month which I think is quite good for someone of my age. I am 6 feet tall, fit - working out regularly for years around 3 times a week. So I'd say I am relatively good looking, educated and have a g",,www.reddit.com,mental health
