title,score,upvote_ratio,num_comments,author,subreddit,url,permalink,created_utc,is_self,selftext,flair,domain,search_query
I (attempted) suicide by crashing my car into a highway median at 200 km/h and walked out with a minor concussion. I feel like it's a sign I need to step up my action against depression. What are some things I can do to alleviate my depression?,2062,0.99,245,ShibaToucher,depression,https://www.reddit.com/r/depression/comments/dkx9yc/i_attempted_suicide_by_crashing_my_car_into_a/,https://www.reddit.com/r/depression/comments/dkx9yc/i_attempted_suicide_by_crashing_my_car_into_a/,1571645466,True,"The title and this story may sound fake (New account to hopefully protect my identity), but I swear to you it could not be more real for me. I wanted to share this, I am not doing this for attention but merely to seek help. More questions will be asked at the end of my story.  As the title describes, a miracle has occurred given the severity and intent of the crash. The paramedics, police, doctors, nurses and my parents all gave me the most puzzled look of their lives when they asked how fast I ",,www.reddit.com,meditation
"""Meditate, exercise, go outside""... how am I supposed to do any of that if my motivation is gone? That's like telling a person with no legs that his legs will grow back if he just starts walking.",207,0.99,35,svaroz1c,depression,https://www.reddit.com/r/depression/comments/5hnn6c/meditate_exercise_go_outside_how_am_i_supposed_to/,https://www.reddit.com/r/depression/comments/5hnn6c/meditate_exercise_go_outside_how_am_i_supposed_to/,1481420106,True,"Meditation does help, but when I'm feeling really bad there's no way in hell I'll find a reason to take time out of my day to do it. If I'm motivated enough to exercise or meditate or whatever, that implies I'm already feeling pretty good. It's like that ""need experience to get job, need job to get experience"" meme.

I dunno what I'm trying to say here, just feeling kinda shitty and had this thought. Sounds like I'm just making excuses, doesn't it.",,www.reddit.com,meditation
23 F. I feel so behind Everyone. I feel like a 13 year old.,1871,1.0,193,probablyasook,depression,https://www.reddit.com/r/depression/comments/hcl4eo/23_f_i_feel_so_behind_everyone_i_feel_like_a_13/,https://www.reddit.com/r/depression/comments/hcl4eo/23_f_i_feel_so_behind_everyone_i_feel_like_a_13/,1592654325,True,"I know I shouldnt complain at 23 But Ive struggled with depression since I was 13. Every year. For 10 years. I have few positive memories. Im tired and I dont want to do keep trying anymore. Everything ive tried never has worked. Meditation. CBT. Psychologists. Psychiatrists. Medication. Sleeping Pills. Weed.

I feel so young (because I havent literally done much at all with my depression+anxiety) but ancient at the same time. I have no passions, no interests. No goals. Havent had good friends i",,www.reddit.com,meditation
"I just spent 3 days eating 2/3 fruits and vegetables, meditating, and biking furiously, miles a day, and I don't know which helps, but I feel happy. I just spent an hour laughing and talking, and I swear I'm significantly smarter.",235,0.94,29,fuuuuuuuuuuuuuuuuuuk,depression,https://www.reddit.com/r/depression/comments/2n2zqp/i_just_spent_3_days_eating_23_fruits_and/,https://www.reddit.com/r/depression/comments/2n2zqp/i_just_spent_3_days_eating_23_fruits_and/,1416668341,True,"
I feel really fucking good. For the first time in literally years. And my headaches are gone. =D

Am I going insane, or was changing my brain chemistry really this easy?",,www.reddit.com,meditation
Anyone else sick of people acting like meditation can solve all your problems?,56,0.99,19,secretlyslytherin,depression,https://www.reddit.com/r/depression/comments/e2obdf/anyone_else_sick_of_people_acting_like_meditation/,https://www.reddit.com/r/depression/comments/e2obdf/anyone_else_sick_of_people_acting_like_meditation/,1574894928,True,"I recognize that it is extremely helpful and very healthy, but I'm sick and tired of people acting like it's the solution to everything. ""Just meditate"" is not helpful advice, it's condescending and belittling. Do they understand how hard it is to meditate when you're already distraught? Ugh I just wanna live in a cave alone",,www.reddit.com,meditation
I wish I killed myself when I was 16,461,0.98,114,Just_Katsuki,depression,https://www.reddit.com/r/depression/comments/1dho216/i_wish_i_killed_myself_when_i_was_16/,https://www.reddit.com/r/depression/comments/1dho216/i_wish_i_killed_myself_when_i_was_16/,1718592685,True,I thought life would get better. Once I was out of hs I thought I'd be free. Here I am at 25 feeling the same way. I have crippling social anxiety that has got me fired from my last 3 jobs. I don't want to find another one bc I know the outcome. My husband is stressed with bills and looks at me differently. I wish I killed myself when I was 16 I was wrong for having hope. I wasn't meant to be here. Medicine doesn't help. Therapy never lasts. I feel like a fly in a glue trap waiting to die.,,www.reddit.com,meditation
"I go to the gym every day, meditate, get fresh air, therapy once a week. But still feel hopeless.",2,1.0,0,TerryHoitz13,depression,https://www.reddit.com/r/depression/comments/10ep2bi/i_go_to_the_gym_every_day_meditate_get_fresh_air/,https://www.reddit.com/r/depression/comments/10ep2bi/i_go_to_the_gym_every_day_meditate_get_fresh_air/,1673993101,True,I don’t know what to do anymore. I am struggling so bad. The feeling of always letting someone down triggers the crap out of me. I don’t go a single day without disappointing someone.,,www.reddit.com,meditation
Exercise and meditation don’t help anymore,3,1.0,1,jklightnup,depression,https://www.reddit.com/r/depression/comments/yrvu1p/exercise_and_meditation_dont_help_anymore/,https://www.reddit.com/r/depression/comments/yrvu1p/exercise_and_meditation_dont_help_anymore/,1668124862,True,"First time posting here. Not sure if I have depression, but let me say that I’m deeply discontent with my life and myself and what I’ve „achieved“. I hate myself with a passion. If I didn’t hurt any people with it I’d seriously contemplate offing myself. But yeah, sadly, some people still love me so it’s not an option.

Anyway, to my recent experience with exercise and meditation. I do a lot of exercise, always have. Used to do it for fun, but those days are long gone. Kept doing it because of t",,www.reddit.com,meditation
y’all ever just give up mid-day and zone the fuck out and start staring into space for prolonged periods of time?????,1887,0.99,108,oobqoobloobh,depression,https://www.reddit.com/r/depression/comments/c0ffzy/yall_ever_just_give_up_midday_and_zone_the_fuck/,https://www.reddit.com/r/depression/comments/c0ffzy/yall_ever_just_give_up_midday_and_zone_the_fuck/,1560484173,True,"like i was at work and my body just shut down and decided not to try anymore so i just stared into space for what felt like 5 minutes, but was actually 30. fuckkkkk this",,www.reddit.com,meditation
Is meditation a legitimate treatment for depression?,8,0.8,38,Poison1990,depression,https://www.reddit.com/r/depression/comments/dlhvg/is_meditation_a_legitimate_treatment_for/,https://www.reddit.com/r/depression/comments/dlhvg/is_meditation_a_legitimate_treatment_for/,1285942040,True,"Today I went to an assessment session to see if I could get counselling. 
I was advised to read some self help books and listen to the CDs in order to teach myself how to meditate. 

I'm a bit of a sceptic when it comes to stuff like that. I was kind of disappointed that I was just palmed off to published experts who want me to meditate. 

Should this treatment be taken seriously?

has it helped anyone else who wasn't taking any other form of treatment at the time?

Am I being closed minded by t",,www.reddit.com,meditation
I tried meditating for the first time today,44,0.97,11,jimmy1421,depression,https://www.reddit.com/r/depression/comments/bw24km/i_tried_meditating_for_the_first_time_today/,https://www.reddit.com/r/depression/comments/bw24km/i_tried_meditating_for_the_first_time_today/,1559508719,True,"Not even gonna lie shit helped me out a lot, felt relaxed and at ease for the first time in a while, going to try and start doing it daily",,www.reddit.com,meditation
Meditation is F@#$ng Amazing!!!,25,0.86,15,IHDN2012,depression,https://www.reddit.com/r/depression/comments/def9q0/meditation_is_fng_amazing/,https://www.reddit.com/r/depression/comments/def9q0/meditation_is_fng_amazing/,1570427034,True,"It's helping me overcome depression, needless sadness and negative thoughts.  Instead of just stewing in bad thoughts all day, I can choose to just let them go.  I feel way, way happier now as a result.  10/10, highly recommend.",,www.reddit.com,meditation
Meditation,14,0.81,14,whiskeredcone,depression,https://www.reddit.com/r/depression/comments/f7m7e2/meditation/,https://www.reddit.com/r/depression/comments/f7m7e2/meditation/,1582338905,True,"Someone tell me try meditation one more time, I will cut you. 
Exercise... you think I should try exercise? Karen, I’m an MMA fighter and power lifter. Your Pilates class won’t cure my depression.",,www.reddit.com,meditation
How to cure depression without taking any medication?,81,0.99,74,Dense_Cod8982,depression,https://www.reddit.com/r/depression/comments/1mfks6h/how_to_cure_depression_without_taking_any/,https://www.reddit.com/r/depression/comments/1mfks6h/how_to_cure_depression_without_taking_any/,1754120555,True,"I am 33F struggling with anxiety and depression for past 3 years, it is just getting worst with each passing time. I am jobless for almost 2 years now, separated from my husband, no kids, no friends, lonely. All day I just want to sleep. Eating and music used to give me some happiness but not anymore. I have lost interest in everything I used to love or enjoy doing before. Everyone around me achieving great things in both their careers and personal lives while I have terribly failed in both area",,www.reddit.com,meditation
"Anti-depressants don't work, Therapy doesn't work, meditation didn't do shit, exercise didn't help, even Ketamine infusions did nothing. There's only one way my suffering will end and that's at the barrel of a gun.",9,0.85,12,Mordcrest,depression,https://www.reddit.com/r/depression/comments/g4piuv/antidepressants_dont_work_therapy_doesnt_work/,https://www.reddit.com/r/depression/comments/g4piuv/antidepressants_dont_work_therapy_doesnt_work/,1587373972,True,"Spent years in therapy, on anti-depressants, tried exercising and eating healthy, i even spent $4,400 on 8 ketamine infusions, and when nothing got better they said wait a few months i could be a late responder, well it's been a few months.....nothing. i'd heard it doesn't always cure you but it always at least helps. Nope i still feel just as shitty as i did last year. I even think i need to accelerate my timeline on killing myself. I was gonna wait 5 years but now i just barely can wait 1 or 2",,www.reddit.com,meditation
I have had major depression my whole life. Meditation has been helping TREMENDOUSLY!,9,1.0,7,IHDN2012,depression,https://www.reddit.com/r/depression/comments/m3r3vw/i_have_had_major_depression_my_whole_life/,https://www.reddit.com/r/depression/comments/m3r3vw/i_have_had_major_depression_my_whole_life/,1615583018,True," Hi.  I have major depression.  It has led to hospitalizations, suicidal thoughts, loss of cherished relationships, etc.

I just felt sad all the time.  I couldn't explain why.

Now,  after meditating daily for a few weeks, I feel better.  Instead of  waking up and feeling sad for no reason, I wake up and I feel happy for  no reason.  This morning I was so giddy I wanted to dance around.  I  asked myself why, and I couldn't really come up with an answer.  It used  to be that I would feel terribl",,www.reddit.com,meditation
I started meditating!!,45,0.96,15,Frenchtsaot3211,depression,https://www.reddit.com/r/depression/comments/6lv6rg/i_started_meditating/,https://www.reddit.com/r/depression/comments/6lv6rg/i_started_meditating/,1499448352,True,"I've started meditating and it's been only a week or so now, and I already kind of feel a bit more clear headed. I feel calmer, but at times I do catch my thoughts drifting and really cultivating on negative feelings. 

I recently also made an appointment to my university's mental health counselor. I had a break through with my friend, and they finally told me how I've been acting to others and how my depression has turned into a lot of anger. It made me really think about how rude I've been to ",,www.reddit.com,meditation
"Meditation, meditation. Fucking meditation.",33,0.9,15,solidfang,depression,https://www.reddit.com/r/depression/comments/76tv2a/meditation_meditation_fucking_meditation/,https://www.reddit.com/r/depression/comments/76tv2a/meditation_meditation_fucking_meditation/,1508190089,True,"Is that everyone's solution to everything? Of course, just go meditate and all your stresses will disappear like fucking magic! Yeah, great... Some time to think upon the multitude of failures that is my life is exactly what I need. I hate everything even more.

I don't know what kind of world people live in that they can just cure themselves so easily, but I just don't get the same out of it as they do. And then they just say you're doing it wrong.

Oh, that's the problem. I'm feeling the wrong",,www.reddit.com,meditation
Meditation,2,0.98,1,Shazzykh,depression,https://www.reddit.com/r/depression/comments/shpu65/meditation/,https://www.reddit.com/r/depression/comments/shpu65/meditation/,1643703104,True,"Does anyone have tried or trying meditation, what were some positive outcomes",,www.reddit.com,meditation
I wish that people would stop asking me to meditate,27,0.92,13,IlovePetrichor,depression,https://www.reddit.com/r/depression/comments/9a12h5/i_wish_that_people_would_stop_asking_me_to/,https://www.reddit.com/r/depression/comments/9a12h5/i_wish_that_people_would_stop_asking_me_to/,1535143845,True,"I mean I do appreciate the concern and love behind the statement but it's a bit much sometimes, especially when it's accompanied as a statement by 'you are in control of your feelings'.

In other news yay the feelings of disconnection, constant body pain and deep deep loneliness accompanied by a side of 'dont bother anyone. You shouldn't have texted anyone. Dammit you just shouldn't exist and bother the whole dam world and are completely replaceable.'

I don't know how much longer I can go on.",,www.reddit.com,meditation
Has meditation helped your depression/ life?,5,1.0,14,Jh_06,depression,https://www.reddit.com/r/depression/comments/9mgywk/has_meditation_helped_your_depression_life/,https://www.reddit.com/r/depression/comments/9mgywk/has_meditation_helped_your_depression_life/,1539019825,True,"If it did, do you have any tips or suggestions? ",,www.reddit.com,meditation
How much does mindfulness meditation actually help?,2,1.0,6,pusheenyourbuttons,depression,https://www.reddit.com/r/depression/comments/ja45up/how_much_does_mindfulness_meditation_actually_help/,https://www.reddit.com/r/depression/comments/ja45up/how_much_does_mindfulness_meditation_actually_help/,1602553531,True,Meditation always comes up as a suggesting for easing depression. I’ve done it a few times but I’m trying to weigh the options of actually doing it on a regular basis. Those who have tried it—what do you think?,,www.reddit.com,meditation
"8 years of depression being semi-fixed with therapy, meditation and life style changes",4,0.84,4,MulberryMaster,depression,https://www.reddit.com/r/depression/comments/l9httu/8_years_of_depression_being_semifixed_with/,https://www.reddit.com/r/depression/comments/l9httu/8_years_of_depression_being_semifixed_with/,1612116155,True,"I’ve been depressed since I was in sixth grade. Seriously depressed. Suicide attempts, thoughts, meaninglessness. The whole kit. All throughout middle school and high school I felt outcasted and insecure. Finally this year I got the guts to reach out to a therapist. 

Just talking about my issues with somebody, nightly meditation, going to the gym, learning to love what I do and picking up video game development really helped me see another day. I finally felt healthy enough to go on a date. And",,www.reddit.com,meditation
Meditating,3,1.0,3,casper199821,depression,https://www.reddit.com/r/depression/comments/mwfepl/meditating/,https://www.reddit.com/r/depression/comments/mwfepl/meditating/,1619127154,True,"This subreddit is mostly about how bad life is, and questions on how to make life a bit more bearable. Not this post, this one is about what you can do when you feel down, not worth it, lonely and so on. This is the first in a series of these kind of posts I’m gonna post on here, I want to help you guys. If these kind of posts aren’t aloud here, feel free to remove or report them. Personally, I think I am able to help a lot of you guys. 

Backstory about me to know who I am:
I’m a 22 year old ma",,www.reddit.com,meditation
I can’t even meditate without getting depressed,2,1.0,3,lazer9993,depression,https://www.reddit.com/r/depression/comments/lnj0sz/i_cant_even_meditate_without_getting_depressed/,https://www.reddit.com/r/depression/comments/lnj0sz/i_cant_even_meditate_without_getting_depressed/,1613749824,True,"I’m 32m.  I’m going through a divorce and I’m so depressed over the past month. I can’t take it. Today I tried to meditate and it just triggered me because it reminded me of my wife and how we used to listen to the same stuff at night when we couldn’t sleep. She would put it on her phone and it was so soothing. 
Now it just makes my heart race and I can’t relax. I fucking hate this. Everything reminds me of her I can’t do anything without seeing her. She was my best friend and partner. I miss he",,www.reddit.com,meditation
"I have been meditating, having cold showers,exercising, having a good diet for 3 month now.",9,0.92,15,gergo1997,depression,https://www.reddit.com/r/depression/comments/635pxh/i_have_been_meditating_having_cold/,https://www.reddit.com/r/depression/comments/635pxh/i_have_been_meditating_having_cold/,1491212247,True,"I still feel like it's not worth living. Tell me 1 good reason not to commit suicide, because I myself can't find one.",,www.reddit.com,meditation
Anyone try meditation?,1,0.67,6,Britt964,depression,https://www.reddit.com/r/depression/comments/graspb/anyone_try_meditation/,https://www.reddit.com/r/depression/comments/graspb/anyone_try_meditation/,1590545500,True,I was looking a bit into meditation but I find it really hard to relax. If you’ve tried it I’d love to hear your experience and if it did or didn’t help. Thanks.,,www.reddit.com,meditation
Meditation is amazing!,52,0.89,13,bunnupcurry,depression,https://www.reddit.com/r/depression/comments/2ps96c/meditation_is_amazing/,https://www.reddit.com/r/depression/comments/2ps96c/meditation_is_amazing/,1418994506,True,"All our thoughts whether be negative or positive swim around in your brain all the time!  Confusion, anger, sadness, regret and self loathing all negative but make the waters very rough, but deep breathing relaxes those waters.  Just a meditative chant in the morning 15 minutes.  It could be anything lol I am sexy in a rhythm .  

If my words help anyone in need today I am thankful
If I made you smile for even one second it means so much to me.  

Anyway happy Friday my eggs are boiling :)",,www.reddit.com,meditation
Meditation,2,0.75,2,Kingmikeharris,depression,https://www.reddit.com/r/depression/comments/lnhszw/meditation/,https://www.reddit.com/r/depression/comments/lnhszw/meditation/,1613746664,True,"Hey im new to the group, my name is Mike Harris and I want to help people find an easier way to meditate and manifest. Let me know if anyone is having any problems I just want to service and help some people for free!",,www.reddit.com,meditation
Anyone try meditating?,7,0.83,14,mrdo0m,depression,https://www.reddit.com/r/depression/comments/4yl6eh/anyone_try_meditating/,https://www.reddit.com/r/depression/comments/4yl6eh/anyone_try_meditating/,1471639503,True,"I've been struggling with depression and anxiety like Hell lately. I've always been depressed, but the past couple months have been particularly rough. Yesterday I tried meditating for 20 minutes. I'm going to try to do this everyday now. It made me fall asleep much earlier than I normally do, and the ride to work today was pretty calm. I wasn't talking to myself nearly as much as I normally do. For the first few hours of work, I was feeling alright. Unfortunately I dug into things and reminded ",,www.reddit.com,meditation
"Depression, Crystals, and Meditation",3,1.0,0,JimmyJimmison,depression,https://www.reddit.com/r/depression/comments/nxktyc/depression_crystals_and_meditation/,https://www.reddit.com/r/depression/comments/nxktyc/depression_crystals_and_meditation/,1623430947,True,"   Before I go further...I just wanted to say what that the following is a little unbelievable. This has alot of speculation in it. I will just start from about a year and a half ago. 

   I've been meditating on and off alot. One night while I was meditating I started to get a bizarre sensation that was akin to popping an ecstasy pill. It started from from feet and ended at the top of my head where the sensation peaked. The whole sensation varied from about 7 to 15 seconds. Not only that, this ",,www.reddit.com,meditation
still struggle with believing i can meditate/think my way out of this vs. needing meds,2,1.0,0,mememyselfandi94,depression,https://www.reddit.com/r/depression/comments/o0pnwm/still_struggle_with_believing_i_can_meditatethink/,https://www.reddit.com/r/depression/comments/o0pnwm/still_struggle_with_believing_i_can_meditatethink/,1623794224,True,"i grew up in an immigrant household where mental illness was never considered ""real"" and you were told ""everybody feels low sometimes."" however, i studied chemistry and worked in pharmaceuticals during college so i understand the nature of clinical depression and how for many people, you need clinical interventions like ssri's. still, sometimes i meet people who say they were depressed/anxious but just changed their lifestyle (e.g., mediation, yoga, eating right, exercise, new job) and ""snapped ",,www.reddit.com,meditation
"Mindfulness, positive thinking, meditation etc",3,1.0,0,LinoLino321,depression,https://www.reddit.com/r/depression/comments/nkn7u7/mindfulness_positive_thinking_meditation_etc/,https://www.reddit.com/r/depression/comments/nkn7u7/mindfulness_positive_thinking_meditation_etc/,1621941264,True,"Does anyone feel like they have tried really hard repeatedly to use these sort of techniques, in the hope that you'll rewire your shitty brain, so  that it doesn't run on this turd of an operating system - but no matter how hard you try, you just can't get away from the inbuilt structure that is in there? Particularly if you're a bit older and have had depression for a long time... It's like as if I am going to be able to change this now by chanting some dumb mantra. Take me out the back and sho",,www.reddit.com,meditation
"i try to exercise, be social, eat healthy, meditation... nothing helps",2,1.0,0,oceanprincess11,depression,https://www.reddit.com/r/depression/comments/n6gs5l/i_try_to_exercise_be_social_eat_healthy/,https://www.reddit.com/r/depression/comments/n6gs5l/i_try_to_exercise_be_social_eat_healthy/,1620332847,True,"i’ve been forcing myself to go on walks everyday (mostly because i’m losing all my muscle tone from being in bed all the time & i don’t want my legs to basically atrophy lol), out in nature for ab an hour. does it improve my mood? no. also i’m always fatigued and exhausted from my health issues.

i take a ton if supplements and probiotics & make sure to eat fruits and veggies everyday. i shower and do “self care” routines, read. i’ve pushed away all of my friends but i hang out w/ my family memb",,www.reddit.com,meditation
Meditation,0,0.5,1,Kingmikeharris,depression,https://www.reddit.com/r/depression/comments/lo92qh/meditation/,https://www.reddit.com/r/depression/comments/lo92qh/meditation/,1613834010,True,"Does anyone have problems with meditating, focusing or negative thoughts? Comment I do?",,www.reddit.com,meditation
Meditate.,2,1.0,5,Jokey06,depression,https://www.reddit.com/r/depression/comments/et740w/meditate/,https://www.reddit.com/r/depression/comments/et740w/meditate/,1579850976,True,"So for the first time this year i arrived on time at work today. I always come an hour to late becease i wake up super tired in the morning. I've been trying to meditate in the evening before i go to bed and today for the first time in years i woke up feeling rested. I always thought meditation was for other people but would never work on me, but today it prove me wrong. Also I've been sober since new years day, i was a Amphetamine addict. 
I feel like for the first time my life is changing and ",,www.reddit.com,meditation
Anyone find meditation/mindfulness helpful for depression?,3,1.0,2,prickli_cactus,depression,https://www.reddit.com/r/depression/comments/j15njq/anyone_find_meditationmindfulness_helpful_for/,https://www.reddit.com/r/depression/comments/j15njq/anyone_find_meditationmindfulness_helpful_for/,1601267839,True,"Hello. I have been meditating every day for about 10 months now and it has done wonderful things to my mind and my understanding of myself. I don't have depression though. My mom and my sister have depression and my bf has bipolar type 2 and spends a lot of time in depressive episodes. 

Meditation has done so much good for me in terms of noticing my thoughts and cultivating a healthier relationship with my negative emotions. I have this wish that they will try it out and that it might help them",,www.reddit.com,meditation
