title,score,upvote_ratio,num_comments,author,subreddit,url,permalink,created_utc,is_self,selftext,flair,domain,search_query
My therapist thinks I'm too depressed for therapy,1549,0.99,151,bestcloserinthecity,depression,https://www.reddit.com/r/depression/comments/jc93qc/my_therapist_thinks_im_too_depressed_for_therapy/,https://www.reddit.com/r/depression/comments/jc93qc/my_therapist_thinks_im_too_depressed_for_therapy/,1602852176,True,"So my therapist that I've only seen two times thinks I'm not a good candidate for therapy. She thinks that I'm too depressed for it despite being on heavy medications that I'm going to see a doctor about and re-evaluate in a few weeks.

She didn't think that a combination of psychotherapy and medications combined would work for me. Instead She suggested ECT treatment after only talking for 80 minutes total.

After doing extensive research this is only offered AFTER you have tried a combination o",,www.reddit.com,therapy
The fact that I have owe $2k in therapy sessions is ridiculous...,1018,0.97,159,BoredasUsual88,depression,https://www.reddit.com/r/depression/comments/pmtwna/the_fact_that_i_have_owe_2k_in_therapy_sessions/,https://www.reddit.com/r/depression/comments/pmtwna/the_fact_that_i_have_owe_2k_in_therapy_sessions/,1631457717,True,"Over the course of the year, I’ve been talking to a therapist and now I owe $2k in therapy. What the fuck is the point of therapy if it cost so much?! I feel so cheated on right now and it’s really depressing to have to deal with this when you’re depressed. How is charging you an arm and leg helpful if you’re struggling with depression? I hate the American health care system so ducking much!😞🤬🤬",,www.reddit.com,therapy
Why do people think therapy is a magic solution?,382,0.98,95,LatePreference606,depression,https://www.reddit.com/r/depression/comments/1gvdazi/why_do_people_think_therapy_is_a_magic_solution/,https://www.reddit.com/r/depression/comments/1gvdazi/why_do_people_think_therapy_is_a_magic_solution/,1732064485,True,"Especially from people who don’t deal with depression. They all seem to think I’m just a sad person who needs comfort and getting heard. But they don’t even know me. A therapist won’t be able to help someone who doesn’t have an ounce of care about helping themselves first.

I know myself enough to acknowledge how I don’t like being comforted. No matter how much someone listens to my vents and tries to make me have deep thoughts about the good parts of life. Things to look forward to. Take small ",,www.reddit.com,therapy
Has therapy or meds helped you guys?,31,0.96,64,Black_Coyote2,depression,https://www.reddit.com/r/depression/comments/1nisbyo/has_therapy_or_meds_helped_you_guys/,https://www.reddit.com/r/depression/comments/1nisbyo/has_therapy_or_meds_helped_you_guys/,1758053432,True,"Those are my last hope, so I hope that they've helped. Life is intolerable.",,www.reddit.com,therapy
"""You need therapy""",958,0.99,120,Antheena,depression,https://www.reddit.com/r/depression/comments/p6pcmi/you_need_therapy/,https://www.reddit.com/r/depression/comments/p6pcmi/you_need_therapy/,1629286549,True,"Therapy is too expensive. £60 for an hour's session each week. How are we supposed to get therapy when it's locked behind such prices? One session isn't going to do it. It's an ongoing expense that's just way too difficult to afford.

I live in the UK and yes, I have tried to get it through the NHS. They told me to wait for a piece of snail mail before I can book anything. I never received it and weeks later they told me they hadn't heard from me so assumed I didn't need them and scratched me of",,www.reddit.com,therapy
I’m so tired of people saying “go to therapy” every time I open my mouth,366,0.99,48,Argument_Massive,depression,https://www.reddit.com/r/depression/comments/1i1xuef/im_so_tired_of_people_saying_go_to_therapy_every/,https://www.reddit.com/r/depression/comments/1i1xuef/im_so_tired_of_people_saying_go_to_therapy_every/,1736949180,True,"it’s like, I do go to therapy. 

It feels like the world doesn’t want me here unless I’m completely self healed and self-actualized. I’m just trying to live my life in the meantime and participate in normal life milestones as best I can, knowing that I’ve been depressed for a long time and it’s a long-term struggle that I try to actively deal with every day. 

But when I talking about a struggle with dating or with clothes or careers or anything that I want advice about or just discourse to just",,www.reddit.com,therapy
I’m tired of people saying that you should go to therapy.,483,0.97,116,Synergy75,depression,https://www.reddit.com/r/depression/comments/10g2bqp/im_tired_of_people_saying_that_you_should_go_to/,https://www.reddit.com/r/depression/comments/10g2bqp/im_tired_of_people_saying_that_you_should_go_to/,1674136594,True,"I am in therapy, I’m also taking medication. Nothing is working, I still feel like shit and worthless. People who say this don’t know what it is like.",,www.reddit.com,therapy
Stop telling me to go to Therapy,146,0.95,82,Doomfollow,depression,https://www.reddit.com/r/depression/comments/1hbbquc/stop_telling_me_to_go_to_therapy/,https://www.reddit.com/r/depression/comments/1hbbquc/stop_telling_me_to_go_to_therapy/,1733863386,True,"If it works for you, then fine don't let me stop you

But nothing makes me more mad then when people say ""just go to therapy"", you know nothing about me, it doesn't work.

Idk how many different ones I've tried, it's never good. After like only 30 minutes of barely getting to know me they try to say I'm ""traumatized"" or ""severely depressed"", which is not true, and puts down people who have been traumatized.

Their solution to my problems? Just think about it differently, or just go for a walk. G",,www.reddit.com,therapy
"I have tried everything from the gym to therapy, I’m almost 30 I think I’m the most hated non famous person in the world",54,0.96,40,OkScore4470,depression,https://www.reddit.com/r/depression/comments/1ll73ke/i_have_tried_everything_from_the_gym_to_therapy/,https://www.reddit.com/r/depression/comments/1ll73ke/i_have_tried_everything_from_the_gym_to_therapy/,1750961049,True,"I don’t have a reason to live, yet I don’t have the guts to kill my self, I’m a pathetic excuse of s human being,  I’ve took tablets to help with my insomnia 3 years I’ve lost a last a year if sleep, I write music that nobody cares about, I’ve very little next nothing in terms of infancy with the opposite sex, I’m absolutely useless really.",,www.reddit.com,therapy
"Nope, it's over, fuck therapy",240,0.94,106,IISiroII,depression,https://www.reddit.com/r/depression/comments/17ilyrn/nope_its_over_fuck_therapy/,https://www.reddit.com/r/depression/comments/17ilyrn/nope_its_over_fuck_therapy/,1698523835,True,"I'm done, therapy doesn't work, I'm tired of going to every therapy possible and wasting money, I will die tomorrow. Fuck it, the world doesn't want me here, so I'm out. No more trying. it's over. Fuck you all.",,www.reddit.com,therapy
Incredibly disappointed by these help subs.I genuinely use them cause I have no support for mental health outside of therapy.And I get little traction if any constantly no matter how much I say I need help.,52,0.91,32,CherrySpaceCadet,depression,https://www.reddit.com/r/depression/comments/1m71cb6/incredibly_disappointed_by_these_help_subsi/,https://www.reddit.com/r/depression/comments/1m71cb6/incredibly_disappointed_by_these_help_subsi/,1753250033,True,"I ask for help in these subs so much,but get flat out ignored most times or very little responses if any.I appreciate all the ones I get,but getting constantly looked over in these subs as well in life makes me feel worthless especially getting nothing even in my worst desperate times. I imagine it’s the same for others in my situation.This treatment has the complete opposite effect when it comes to helping others,and don’t understand treating others like this at all.

Edit: Thank you to everyon",,www.reddit.com,therapy
"I'm 26, and this is my response to therapy. And also the reason I stopped going.",37,0.94,29,Mobile-Fault-2000,depression,https://www.reddit.com/r/depression/comments/1mdyywl/im_26_and_this_is_my_response_to_therapy_and_also/,https://www.reddit.com/r/depression/comments/1mdyywl/im_26_and_this_is_my_response_to_therapy_and_also/,1753961177,True,"Your great plan is that I have to get up and start doing something...  
But I don’t want to.  
I won’t get out of this.  
I don’t have it in me anymore.  
It’s simply better to stay in this bubble, do nothing that would disrupt the comfort I have now –  
survive another day, until the end of my days.  
Because then I’ll be able to say: “Okay… I made it, I experienced a little something…”

But I’m no longer afraid of dying without ever having truly lived.  
I’ve accepted it.  
That was my past, i",,www.reddit.com,therapy
"They way people say, 'Get Therapy!', almost feels like slur.",207,0.97,38,HollowSaintz,depression,https://www.reddit.com/r/depression/comments/1h9bcbl/they_way_people_say_get_therapy_almost_feels_like/,https://www.reddit.com/r/depression/comments/1h9bcbl/they_way_people_say_get_therapy_almost_feels_like/,1733633921,True,"The failure to recognize that people might have already gone through conventional means is; even more depressing.

Its almost like they don't want me, but want me to live so they can laugh and cherish of what they avoided in becoming.

>You did several years of therapy and that still didn't fix you? You must be a terrible person.",,www.reddit.com,therapy
Therapy just made me more aware of how isolated I feel because most people suck at empathy,1059,0.99,55,sakurasoda,depression,https://www.reddit.com/r/depression/comments/cbhfwy/therapy_just_made_me_more_aware_of_how_isolated_i/,https://www.reddit.com/r/depression/comments/cbhfwy/therapy_just_made_me_more_aware_of_how_isolated_i/,1562769178,True,"I’ve been in therapy for years. In that I’ve been able to identify what has made me so depressed growing up and I try to deal with it. I spend a lot of time using coping methods and trying my best. For a depressed person I manage to excel in life.

Currently dealing with the sting of a breakup. Went on vacation to Asia and Ex broke NC before my trip to wish me well after what I gather was him finding out the grass isn’t greener.

I’m on a dream vacation with my older sister and her child while w",,www.reddit.com,therapy
How is ur therapy sessions like,25,0.97,20,FederalPlan5430,depression,https://www.reddit.com/r/depression/comments/1mxapaq/how_is_ur_therapy_sessions_like/,https://www.reddit.com/r/depression/comments/1mxapaq/how_is_ur_therapy_sessions_like/,1755878986,True,"I just had my first therapy session, and overall, it went pretty well. I was able to talk about my life, and it felt like dropping a weight from my shoulders. However, I couldnt be completely honest and talk about the main reason I went there, my suicidal thoughts. I didn't tell her how I REALLY feel, and that is making me uncomfortable.

I think its normal not to be 100% honest with ur therapist, especially in a first session. But I want to know if therapy works for u guys. How honest are you w",,www.reddit.com,therapy
therapy never fucking helps,15,0.9,18,Lumpy_Information_57,depression,https://www.reddit.com/r/depression/comments/1n9mye6/therapy_never_fucking_helps/,https://www.reddit.com/r/depression/comments/1n9mye6/therapy_never_fucking_helps/,1757122269,True,"therapy doesn’t do shit when your life genuinely just fucking sucks okay, and whenever i  tell people that, they get uncomfortable. the world just fucking sucks. taking pills or anything else doesn’t fix it. the rich are getting richer, the world is full of rapists, misogynists, racists. everyone sucks. i   got severe asthma, which is extremely disabling, and my life sucks because of it too. i’ve been sick my whole life, moving from hospital to hospital since i was a  child, and it has completel",,www.reddit.com,therapy
I really hate therapy,15,0.95,15,Historical_Fee2167,depression,https://www.reddit.com/r/depression/comments/1ne8znj/i_really_hate_therapy/,https://www.reddit.com/r/depression/comments/1ne8znj/i_really_hate_therapy/,1757597706,True,"Yeah, obviously title. I've been forced back in a while back. I did 3 years of therapy like 6 or 7 years ago. I don't remember any of it. It made me realise I'm hopeless and life won't get better, so success I guess? Somehow I've survived up to now.

Anyhow, through some twists and turns, the current situation is that I had to find a new therapist. Otherwise I was at a risk of losing my benefits. Everything fully paid, so it's not that bad, it's not like I'm losing money.

But damn, every appoin",,www.reddit.com,therapy
I can't afford therapy. I need help I know no-one cares but Im so angry,103,0.95,58,Static0722,depression,https://www.reddit.com/r/depression/comments/1epl46d/i_cant_afford_therapy_i_need_help_i_know_noone/,https://www.reddit.com/r/depression/comments/1epl46d/i_cant_afford_therapy_i_need_help_i_know_noone/,1723383797,True,"FUCK TWITTER. Fuck those pathetic pieces of shits. Fucking assholes the lot of them. They have the nerve to pretend their the good guys? After telling me those horrible things? Fuck em. Oh but its not just Twitter they are fucking everywhere. I have so many problems I hate people. Not a people person. I hate the world, I hate myself. I feel like killing myself. I can't afford therapy. I have no money. Because thats how it works. You only get help if you have money. Thats all they care about",,www.reddit.com,therapy
"im actually sick of hearing ""yoga"" and ""therapy as a remedy of depression",46,0.93,21,Actioncess,depression,https://www.reddit.com/r/depression/comments/1ln69f5/im_actually_sick_of_hearing_yoga_and_therapy_as_a/,https://www.reddit.com/r/depression/comments/1ln69f5/im_actually_sick_of_hearing_yoga_and_therapy_as_a/,1751172378,True,"This post is full of hate on yoga i forged over from people saying yoga is a cure to depression, If you want to do the physical benefits of yoga then go to the gym and not the bs yoga instructors. I know its a long paragraph, but when people hear about depression and people thing YoGa is the way like no its obviously not. I never considered trying it and never will my personal opinion the spirit stuff is absolute worst part, Im so sick of people acting like yoga is the magical cure for depressio",,www.reddit.com,therapy
I don't know what to talk about in therapy anymore.,90,0.99,41,mrl993,depression,https://www.reddit.com/r/depression/comments/1hcv2sr/i_dont_know_what_to_talk_about_in_therapy_anymore/,https://www.reddit.com/r/depression/comments/1hcv2sr/i_dont_know_what_to_talk_about_in_therapy_anymore/,1734036816,True,I feel that therapy sessions are pointless and I'm wasting my money. My life is so routinary and there isn't much to talk about. It seems this is not working. Maybe some of you feel the same. At this time of the year I feel tired and I don't want to do anything.,,www.reddit.com,therapy
Is this normal with therapy?,9,1.0,8,DisastrousSugar8334,depression,https://www.reddit.com/r/depression/comments/1o9ca7i/is_this_normal_with_therapy/,https://www.reddit.com/r/depression/comments/1o9ca7i/is_this_normal_with_therapy/,1760732927,True,"I’ve noticed that when I finally get to my therapy session, the stuff that hit me hard earlier in the week doesn’t feel as intense anymore, so I kinda brush it off. But later I always wish I’d talked about it. Anyone else deal with that and how do you all handle it??",,www.reddit.com,therapy
What happens in Therapy?,184,0.98,118,ConfusedReditor101,depression,https://www.reddit.com/r/depression/comments/sh09pq/what_happens_in_therapy/,https://www.reddit.com/r/depression/comments/sh09pq/what_happens_in_therapy/,1643632571,True,"I have an apointment with a therapist, I am afraid, what are some questions I'll be asked, can I prepare myself? Pls any help is whellcome.",,www.reddit.com,therapy
Therapy doesn't add meaning to life,55,0.98,14,Irwtfdrn,depression,https://www.reddit.com/r/depression/comments/1lyldth/therapy_doesnt_add_meaning_to_life/,https://www.reddit.com/r/depression/comments/1lyldth/therapy_doesnt_add_meaning_to_life/,1752385906,True,"You can go to therapy all day every day but it will never add meaning to your life, it will never add joy, it will never add a reason to live.",,www.reddit.com,therapy
Should I do therapy?,1,0.67,7,FlavourlessPie,depression,https://www.reddit.com/r/depression/comments/1o5sdmd/should_i_do_therapy/,https://www.reddit.com/r/depression/comments/1o5sdmd/should_i_do_therapy/,1760381115,True,"My mum wants me to go but I hate the idea. I know she wants me to go, and I know she’ll feel better if I do. But I will hate every second",,www.reddit.com,therapy
Ok first post I’m terrified of therapy what should I do?,1,1.0,8,curiousvirgin420,depression,https://www.reddit.com/r/depression/comments/1ntn5pp/ok_first_post_im_terrified_of_therapy_what_should/,https://www.reddit.com/r/depression/comments/1ntn5pp/ok_first_post_im_terrified_of_therapy_what_should/,1759164417,True,For context I just did an online depression test and they say  I have SEVERE depression but I also don’t wanna try therapy because I’ve had incredibly shitty experiences with therapists and explaining how I feel and putting it into words is just impossible for me…… I think I’m just completely fucked and need to bottle everything up because letting it out will push people away what should I do?,,www.reddit.com,therapy
I don't know how or where to find therapy,1,1.0,5,Brakower,depression,https://www.reddit.com/r/depression/comments/1o81r2y/i_dont_know_how_or_where_to_find_therapy/,https://www.reddit.com/r/depression/comments/1o81r2y/i_dont_know_how_or_where_to_find_therapy/,1760607580,True,Im 17 so I have no money and I do not want my parents to know for good reasons. Ive finished school and im not studying this year. Im currently in a country which language i dont know of so I cant go in person and even if I knew the language im in a small old city so I dont think there even is a therapist here. I looked online but couldnt find anything and even then I feel like online it would be way less effective than in person. And even even then i dont know how to find time or privacy to do ,,www.reddit.com,therapy
Any experiences with Cerebral for online therapy and psychiatry?,1,1.0,2,peevedmountainboar,depression,https://www.reddit.com/r/depression/comments/1oj294d/any_experiences_with_cerebral_for_online_therapy/,https://www.reddit.com/r/depression/comments/1oj294d/any_experiences_with_cerebral_for_online_therapy/,1761738211,True,"Not sure if this is the right place to ask but either way this will be my last try.   
  
I tried asking in some other subreddits and either didn't get responses or was told to look into private practices, which tbf is good advice but doesn't exactly meet my needs right now. 

I'm looking at Cerebral because I like being able to get therapy and psychiatry in one spot and it seems like I could get help with medication pretty quickly, whereas I've heard making an appointment with a psychiatrist co",,www.reddit.com,therapy
"I cannot afford therapy in a ""free healthcare"" country",119,0.97,71,123ww55ssopa,depression,https://www.reddit.com/r/depression/comments/170qsl2/i_cannot_afford_therapy_in_a_free_healthcare/,https://www.reddit.com/r/depression/comments/170qsl2/i_cannot_afford_therapy_in_a_free_healthcare/,1696533808,True,"I live in a country that is supposed to have free healthcare, but even though I am very suicidal, I can't get help and see a psychotherapist.

Psychotherapists should be free if you have an insurance, but all of them are ""overbooked for insurance clients"" and only accept self-paying clients. I am a student with a part time job and I don't have 50-70€ a session. I have only 300 something in my bank account, which is making me more depressed.

I don't know what to do anymore and I don't think I wi",,www.reddit.com,therapy
"Everyone says to go to therapy, but I’m too depressed for that",2,1.0,1,Lee_Harden,depression,https://www.reddit.com/r/depression/comments/1ojh49u/everyone_says_to_go_to_therapy_but_im_too/,https://www.reddit.com/r/depression/comments/1ojh49u/everyone_says_to_go_to_therapy_but_im_too/,1761773126,True,"Last time I was in therapy was almost two years ago. And even then, I was too depressed to do anything the therapist told me to do. No matter how “easy” it is. Medication didn’t help either. I just don’t know what to do when it’s this bad. I can’t help myself and the “professional help” doesn’t do anything either. ",,www.reddit.com,therapy
I need therapy but I'm broke. What do I do?,110,0.96,67,htraptor,depression,https://www.reddit.com/r/depression/comments/179gn32/i_need_therapy_but_im_broke_what_do_i_do/,https://www.reddit.com/r/depression/comments/179gn32/i_need_therapy_but_im_broke_what_do_i_do/,1697490143,True,"I'm getting very depressed and suicidal again. I've been out of therapy for about a year. I just can't afford it with or without insurance. 

What do I do?",,www.reddit.com,therapy
Need therapy,2,1.0,1,Special-Fox1487,depression,https://www.reddit.com/r/depression/comments/1og3fds/need_therapy/,https://www.reddit.com/r/depression/comments/1og3fds/need_therapy/,1761428328,True,Have you ever been afraid to say something that’s in your head cuz you know if you do then you will feel guilty for it?  ,,www.reddit.com,therapy
How can I stop dissociating constantly (I’ve never been to therapy so drop the basics),1,1.0,1,Late-Mongoose380,depression,https://www.reddit.com/r/depression/comments/1ofm3he/how_can_i_stop_dissociating_constantly_ive_never/,https://www.reddit.com/r/depression/comments/1ofm3he/how_can_i_stop_dissociating_constantly_ive_never/,1761379946,True,"From a very young I developed dissociation, day dreaming and escapism (such as video games, movies, anything that takes me away from my reality) as coping mechanisms. I had a good childhood for the most part but in times of stress or sadness I’d dissociate, at 13 I began experiencing depression and lost 8 months of my life at 15 from dissociation due to my depression before being able to pull myself out. In short I’ve always dissociated for small periods of time but I was able to control it.

Th",,www.reddit.com,therapy
Does therapy help?,8,0.91,13,Commercial_Ad5721,depression,https://www.reddit.com/r/depression/comments/1m58m6j/does_therapy_help/,https://www.reddit.com/r/depression/comments/1m58m6j/does_therapy_help/,1753069348,True,I'm desperate at the point it's either I start therapy (which I have no idea would it work and it's expensive for me) or I just commit suicide. I tried to attempt but I couldn't unfortunately.,,www.reddit.com,therapy
dont feel like doing therapy or anything,1,1.0,0,Smart-Spare-1103,depression,https://www.reddit.com/r/depression/comments/1oi1kzn/dont_feel_like_doing_therapy_or_anything/,https://www.reddit.com/r/depression/comments/1oi1kzn/dont_feel_like_doing_therapy_or_anything/,1761630565,True,"just going to drop out of college 

admit my failure 

and now i wait. it just keeps getting worse",,www.reddit.com,therapy
How is therapy supposed to help depression?,10,1.0,4,Worth-Ad1913,depression,https://www.reddit.com/r/depression/comments/1nnacn1/how_is_therapy_supposed_to_help_depression/,https://www.reddit.com/r/depression/comments/1nnacn1/how_is_therapy_supposed_to_help_depression/,1758506942,True,"Or any issue for that matter.  I’ve been in therapy for 3 and a half months and it has been the biggest waste of my money and time I’ve ever seen. My therapist is a nice guy and is kind of helpful for some specialized stuff but that’s it.  I told him how I’m unhappy, hopeless, bored, and frustrated with how little my life has changed despite my efforts (exercise, going outside, talking to people, etc).  He suggested to find a new hobby and do fun things more often.  Yeah I could’ve guessed that ",,www.reddit.com,therapy
Feeling Like A Med and Therapy Failure,2,1.0,0,MyHeartFarted,depression,https://www.reddit.com/r/depression/comments/1ogbcnv/feeling_like_a_med_and_therapy_failure/,https://www.reddit.com/r/depression/comments/1ogbcnv/feeling_like_a_med_and_therapy_failure/,1761452208,True,"I know it takes time to get better with medication and therapy, however, I've been doing both for over a year ever since I finished IOP.

I have tools from therapy, I've used them and it works great to keep me from falling into the abyss again. Though the toolbox from IOP and therapy work, neither keep the sadness from seeping in a lot of the time. 

I don't know what else I need to do and my therapist just says always use the tools you have. My meds have been adjusted three times... What am I d",,www.reddit.com,therapy
Shopping/Spending Therapy?,2,1.0,0,22244244,depression,https://www.reddit.com/r/depression/comments/1ofqh7k/shoppingspending_therapy/,https://www.reddit.com/r/depression/comments/1ofqh7k/shoppingspending_therapy/,1761395888,True,"Anyone else just constantly buy new things they want in an attempt to make themself happier? In the end it just hurts the pockets more. It seems like every week I have to buy something whether if its big (over $100 USD) or small ($10 USD or under). I had a family member pass away in February and another in March. Since the first one passed away in February I said to myself that life is short. And I just started buying a ton of stuff for myself. Some stuff I didn’t need, but some stuff that can t",,www.reddit.com,therapy
