title,score,upvote_ratio,num_comments,author,subreddit,url,permalink,created_utc,is_self,selftext,flair,domain,search_query
"Our most-broken and least-understood rules is ""helpers may not invite private contact as a first resort"", so we've made a new wiki to explain it",2367,1.0,177,SQLwitch,depression,https://www.reddit.com/r/depression/comments/doqwow/our_mostbroken_and_leastunderstood_rules_is/,https://www.reddit.com/r/depression/comments/doqwow/our_mostbroken_and_leastunderstood_rules_is/,1572360722,True,"We understand that most people who reply immediately to an OP with an invitation to talk privately  mean only to help, but this type of response usually leads to either disappointment or disaster.  it usually works out quite differently here than when you say ""PM me anytime"" in a casual social context.  

We have huge admiration and appreciation for the goodwill and good citizenship of so many of you who support others here and flag inappropriate content - even more so because we know that so ma",,www.reddit.com,
"Regular check-in post, with essential information about our rules and resources",55,0.98,144,SQLwitch,depression,https://www.reddit.com/r/depression/comments/1jys8x9/regular_checkin_post_with_essential_information/,https://www.reddit.com/r/depression/comments/1jys8x9/regular_checkin_post_with_essential_information/,1744611968,True,"Welcome to /r/depression's check-in post - a place to take a moment and share what is going on and how you are doing. If you're having a tough time but prefer not to make your own post, or have an accomplishment you want to talk about (these aren't allowed standalone posts in the sub as they violate the ""role model"" rule),  this is a place you can share.

-----

Our subreddit rules are very different from most of the rest of reddit!  Since all of them exist for important reasons, we ask everyone",,www.reddit.com,
Spent all day in bed.,103,0.99,7,Alarming-Dig3964,depression,https://www.reddit.com/r/depression/comments/1ojv323/spent_all_day_in_bed/,https://www.reddit.com/r/depression/comments/1ojv323/spent_all_day_in_bed/,1761816648,True,"I spent all day in bed, with a full bottle of pills by my side, I had no strength to go for it. No more strength for anything in general, haven't showered for days, only ate one meal today,  only got up to use the restroom, and even then I was thinking what's even the point to get up for that. I'm just decaying away anyways. Didn't acknowledge my family much. It's always temporary. I can't sleep either, just endless anxiety, sorrow, disappointment, and pain. Just here. What for is a mystery. See",,www.reddit.com,
I can't live. I can't die.,44,1.0,47,Altruistic_Froyo_174,depression,https://www.reddit.com/r/depression/comments/1ojzf4p/i_cant_live_i_cant_die/,https://www.reddit.com/r/depression/comments/1ojzf4p/i_cant_live_i_cant_die/,1761830182,True,"I'm 21f.
I hate Everything. Everyone. My life. It's become so so pathetic, so miserable.  
I always thought i was meant for big things, to do something remarkable. But now? I don't even have the will to live. 
I have no friends, I'm not good at making any relationships either. Not good at social things.
I keep rotting in my home. I do want to do things but i just can't.

It hurts so so much here. In my heart. It feels empty. My chest feels empty. Hollow. I can't feel nothing except... Hurt?

My ",,www.reddit.com,
Is High-Functioning Depression as worst as Depression?,50,0.9,49,Minimum-Rise-7751,depression,https://www.reddit.com/r/depression/comments/1ojtoe9/is_highfunctioning_depression_as_worst_as/,https://www.reddit.com/r/depression/comments/1ojtoe9/is_highfunctioning_depression_as_worst_as/,1761810937,True,"Simple question that I need an answer to, no big paragraph, no long essay. Just a genuine question that I need y'all's help in. Please. ",,www.reddit.com,
What's your story with meds?,18,0.95,31,Far-Note6102,depression,https://www.reddit.com/r/depression/comments/1ojztgx/whats_your_story_with_meds/,https://www.reddit.com/r/depression/comments/1ojztgx/whats_your_story_with_meds/,1761831159,True,"Im literally stopping mirtazapine.
It feels good but it sexually supress me and at the same time that stupid craving wont go away. However, I did learn one thing and is thay I should prioritize my health and my overall sleep hygiene. I never realized how good I felt when I slept like a baby.

Overall, I just dont think I like medication. However , I am keeping it just in case I felt suicidal again.

How about you whats your story with meds?

",,www.reddit.com,
For people like us... Is it normal to always consider the s word?,8,0.9,4,Metal-Egg7363,depression,https://www.reddit.com/r/depression/comments/1ok6nua/for_people_like_us_is_it_normal_to_always/,https://www.reddit.com/r/depression/comments/1ok6nua/for_people_like_us_is_it_normal_to_always/,1761846769,True,"And yeah I read up on the subreddit's material about how depression doesn't always carry the s-cide package with it... Which I'm assuming means not all clinically depressed people are s-cidal.

For those of us who are tho... Is this normal or am I just a weirdo? Like, is it normal to have intrusive thoughts of this everytime I'm feeling even slightly shitty? It's not even an instance where I'd seriously consider it, it could be a normal day and then either something goes awful or I have a depres",,www.reddit.com,
Gov. Shutdown is my last straw,7,1.0,2,Important_Ad_7196,depression,https://www.reddit.com/r/depression/comments/1ok6nfi/gov_shutdown_is_my_last_straw/,https://www.reddit.com/r/depression/comments/1ok6nfi/gov_shutdown_is_my_last_straw/,1761846741,True,"26F. I’ve been applying for jobs non stop for weeks/months with no call backs at all, I’m broke, have no idea how I will afford food everyday for the next month and I’m living with my toxic and narcissistic mother because I can’t afford to move out in the expensive area I live in. And now I can’t even get food assistance temporarily . I just want to die. I’m tired of living this stupid life. All because my mother chose to have me at 48 years old with a man who walked away from us both when I was",,www.reddit.com,
Fuck People,133,0.99,22,OwlApprehensive9809,depression,https://www.reddit.com/r/depression/comments/1ojmz4r/fuck_people/,https://www.reddit.com/r/depression/comments/1ojmz4r/fuck_people/,1761788184,True,"NO one would care if I commit suicide but they all treat me like a terrorist if I miss school for 4 days . 

  
",,www.reddit.com,
I can't do this anymore,9,1.0,1,Tomoko347,depression,https://www.reddit.com/r/depression/comments/1ok27pz/i_cant_do_this_anymore/,https://www.reddit.com/r/depression/comments/1ok27pz/i_cant_do_this_anymore/,1761836805,True,"I really cannot do anymore. I don't want to type. I just feel miserable. I am hurt. I don't know what to do anymore. I want to end all of the things. Not die. Just want to end. I..,...",,www.reddit.com,
Years of depression are catching up,39,0.94,8,ThatAd4351,depression,https://www.reddit.com/r/depression/comments/1ojsmwl/years_of_depression_are_catching_up/,https://www.reddit.com/r/depression/comments/1ojsmwl/years_of_depression_are_catching_up/,1761806710,True,"I am 31(f) and I have had depression for as long as I can remember. I’ve tried not to show it or get my family involved in my mental health struggles but it shows up sometimes. 
I am single and cannot for the life of me find a partner, which I have no qualms about. No point dragging someone down when I cannot deal with it myself. 
Three months ago I quit my decent job to focus on my physical health and came back home. And now, I can’t seem to land a job. I do interviews and almost make it but ne",,www.reddit.com,
It sucks that I feel already dead,9,1.0,3,Terrible-Swim-6786,depression,https://www.reddit.com/r/depression/comments/1ok1e46/it_sucks_that_i_feel_already_dead/,https://www.reddit.com/r/depression/comments/1ok1e46/it_sucks_that_i_feel_already_dead/,1761834893,True,"I move around and I feel like a ghost. I went to a calisthenics park near my house the other night. It was raining and I knew nobody would be there. I was sort of ready to end it all.

I say sort of because I ended up chickening out. I parked the car, went up to the pull up bar and did a few pullups, and then a couple of dips. Cars were passing by but couldn't see me because of the darkness and I felt so detached from reality...but also free.

It feels like I am just delaying my funeral. There's",,www.reddit.com,
self castration,9,0.68,14,Salmonus_Kim,depression,https://www.reddit.com/r/depression/comments/1ok0r9v/self_castration/,https://www.reddit.com/r/depression/comments/1ok0r9v/self_castration/,1761833388,True,"I took T-blockers and high dose of estradiol for over two years for castration. I just can't let myself have any relationship with women. It feels so disgusting and cringe. 
Now my mind and body is entirely feminized and yet I am so tired of any sexual relationship and such. My family avoids me to the point that I currently live with my grandma. I tear up every day even with antidepressants and multiple sleep aids. I can't sleep without draining myself. What should I do? My mom thinks I have BPD",,www.reddit.com,
Haven’t met a single genuine person,12,0.94,9,Rawrwrr,depression,https://www.reddit.com/r/depression/comments/1ojwx0d/havent_met_a_single_genuine_person/,https://www.reddit.com/r/depression/comments/1ojwx0d/havent_met_a_single_genuine_person/,1761823089,True,"This entire year really came for me, so many people and not a single one true and genuine connection.

Feels like I’m not worthy or just not destined to have those friendships or relationships that lasts",,www.reddit.com,
Goodbye and thanks,18,0.95,5,BelezBonafide1,depression,https://www.reddit.com/r/depression/comments/1ojuw15/goodbye_and_thanks/,https://www.reddit.com/r/depression/comments/1ojuw15/goodbye_and_thanks/,1761815874,True,"Probably my last post on here ever. Hey ive been on reddit for a while. I deleted a couple of my posts and thats fine
I am not alright with my life in general. I kind of think im not fine. Im dont know what ive been up to and thats fine.
Goodnight everyone you were very kind. Im not asking for pity or anything i just wanted to let someone know at least. Thanks for everything even if no ones there.",,www.reddit.com,
I’m going to kms.. soon,5,1.0,5,Parking_Selection393,depression,https://www.reddit.com/r/depression/comments/1ok4n5n/im_going_to_kms_soon/,https://www.reddit.com/r/depression/comments/1ok4n5n/im_going_to_kms_soon/,1761842268,True,"I don’t want or need any encouragement to live or anything my mind is made up, i’m horrible and pathetic and i’m a bitch who can never let go. I won’t get better i’m not capable i’m just a burden. i’m don’t depressed im just done trying, nothing ever works nothing gets better. shit is pointless.",,www.reddit.com,
I’m really trying to get through this phrase but I don’t think it’s for me. Everything is pointing me to the direction that whatever I do isn’t enough to fix,3,1.0,1,d-3-e,depression,https://www.reddit.com/r/depression/comments/1ok6j98/im_really_trying_to_get_through_this_phrase_but_i/,https://www.reddit.com/r/depression/comments/1ok6j98/im_really_trying_to_get_through_this_phrase_but_i/,1761846487,True,"I just feel really low right now... like I'm going through so much on my own, I don’t know how to manage everything. I've been trying to get through it by myself because lately I've started to realise that no one actually cares the way I hoped they would and that’s not just me saying this.. people have really proven to my they haven’t scared one bit and it’s very very hurtful to cone to terms with but I’m trying to be strong. It's such a lonely feeling. I picked up my antidepressants today (whic",,www.reddit.com,
Never felt like a first choice,3,1.0,0,Thowawayventing111,depression,https://www.reddit.com/r/depression/comments/1ok6ggu/never_felt_like_a_first_choice/,https://www.reddit.com/r/depression/comments/1ok6ggu/never_felt_like_a_first_choice/,1761846311,True,"Ever since i was young, i've always felt like i wasnt someone people really prioritised. I wish i was someones favourite person or something. Sometimes i'll hear people express how much others mean to them, and i wish people would say that kind of stuff about me. I wish people expressed how much i meant to them. I feel as if if they ever needed someone, I wouldnt be the first person they'd think to go to. I want that level of connection with someone, anyone. I'm terrified im never going to have ",,www.reddit.com,
Cried in Front of Daughter,375,0.98,68,CalendarUnusual9500,depression,https://www.reddit.com/r/depression/comments/1oj70os/cried_in_front_of_daughter/,https://www.reddit.com/r/depression/comments/1oj70os/cried_in_front_of_daughter/,1761750409,True,"Yesterday my four-year old was having a tantrum, screaming at me and I lost it.   I began sobbing, asking her to please not be mad at me.  Im already struggling and at my wits end and I just couldn't control my emotions.   

She began apologizing for getting mad at me, which of course made me feel worse.  Its not a child's fault.  She should never have seen me cry.  A child has no business wiping away a parent's tears and reassuring them things will be okay.

Later in the evening, she mentioned ",,www.reddit.com,
Life’s a nightmare,3,1.0,0,Own_Direction_,depression,https://www.reddit.com/r/depression/comments/1ok5o4m/lifes_a_nightmare/,https://www.reddit.com/r/depression/comments/1ok5o4m/lifes_a_nightmare/,1761844549,True,When I’m able to sleep it’s my favourite thing to do in this existence. Just an absence of consciousness. Sometimes I have dreams but most of the time it’s a blank space in time where I don’t think or feel anything.. then I wake up again. Back into this hell of a life. Hate the work that is required just to prolong my days on this planet. First thing I do when I wake up is curse my existence ,,www.reddit.com,
They said I overreacted!,6,1.0,1,Sunshine_2097,depression,https://www.reddit.com/r/depression/comments/1ok125z/they_said_i_overreacted/,https://www.reddit.com/r/depression/comments/1ok125z/they_said_i_overreacted/,1761834112,True,"So I got my 2 clothes from dry cleaning
And they (dry cleaner) fucking wrote on the inside of the collar with permanent marker
Hik
Idk what it means but wtv
I told my parents
Clearly angry w it
They shouted at me back
I cried
I did sh
And my thigh is kinda bleeding?",,www.reddit.com,
Life after suicide attempts,7,1.0,5,Ok-Lecture7170,depression,https://www.reddit.com/r/depression/comments/1ojzazt/life_after_suicide_attempts/,https://www.reddit.com/r/depression/comments/1ojzazt/life_after_suicide_attempts/,1761829883,True,"Hey there. I'm just wondering for those that had a failed suicide attempt. What happens after a failed attempt? Are you forced into a mental hospital or anything like that? Did you lose your kids and partner afterwards? How long afterwards were you able to get back to living life, like you did before the attempt? Will you be left alone",,www.reddit.com,
i feel so tired of everything...,4,0.84,11,CardiologistFar6658,depression,https://www.reddit.com/r/depression/comments/1ok0kvf/i_feel_so_tired_of_everything/,https://www.reddit.com/r/depression/comments/1ok0kvf/i_feel_so_tired_of_everything/,1761832977,True,"and it all gets so overwhelming sometimes, so freakin suffocating....So suffocating that it physically hurts like my chest is crushing on itself..like i got so much weight on  my chest and i wanna let it out but for SOME REASON I CANNOT LET IT OUT NO MATTER HOW HARD I TRY!? i cannot cry, i tried drawing, blastinc music, going on a walk, cutting...nothing helps",,www.reddit.com,
im a fucking pussy,31,0.87,13,Neither_Gur_5022,depression,https://www.reddit.com/r/depression/comments/1ojple3/im_a_fucking_pussy/,https://www.reddit.com/r/depression/comments/1ojple3/im_a_fucking_pussy/,1761795800,True,"Ive tried to commit multiple times, sometimes drinking chemicals, sometimes trying to choke myself with the vacuum cord, sometiems wanting to jump off a roof. does anyone have any tips or tricks to make it easier? Young and broke so cant buy supplies online.",,www.reddit.com,
What the hell do I actually do,2,1.0,1,xjjj_,depression,https://www.reddit.com/r/depression/comments/1ok7rbu/what_the_hell_do_i_actually_do/,https://www.reddit.com/r/depression/comments/1ok7rbu/what_the_hell_do_i_actually_do/,1761849214,True,"Well first of all, I've tried CBT a couple times and I first tried medications 3 years ago and I've gone through sertraline, fluoxetine and citalopram which was quite helpful but it made me gain so much weight. Not great since I've had disordered eating since I was a little kid. 

I've been off meds for almost a month now and I am spiralling. I can't do anything without flying into a fit of rage that I can't control. I swear the wind blowing too hard could make me cry uncontrollably for hours. 
",,www.reddit.com,
This life is endless,3,0.72,2,The_Owl_,depression,https://www.reddit.com/r/depression/comments/1ok3fwq/this_life_is_endless/,https://www.reddit.com/r/depression/comments/1ok3fwq/this_life_is_endless/,1761839619,True,"35m here, I recently went through a bunch of health scares recently that have taken a mental toll on me. I’ve always been a very paranoid person. I also have ADHD which has been the bane of my existence. For the past month I’ve thought of nothing but dying, I’ve even considered taking my own life but, I know that I can’t. I’m married with 2 children. I have the most wonderful wife and my kids adore me. Me imagining the reactions of my entire family if I were to attempt suicide is enough for me t",,www.reddit.com,
Fed up with my pointless life.,6,0.87,5,b4tgvrl,depression,https://www.reddit.com/r/depression/comments/1ojz4c3/fed_up_with_my_pointless_life/,https://www.reddit.com/r/depression/comments/1ojz4c3/fed_up_with_my_pointless_life/,1761829404,True,"I am a woman in my mid 20s. I grew up an only child with an overbearing mom and a dad that doesnt care, has several other sons that he’s way more interested in. I live with my mom and I havent worked a real job since the beginning of the year because of severe anxiety and depression. 

I’ve been going to therapy for almost 10 years. I have two therapists and I recently realized how pointless therapy is for me. It only “works” for people with issues that resolve themselves. I realized this when I",,www.reddit.com,
Feels like I’m at a dead end,2,1.0,2,VegetableAromatic444,depression,https://www.reddit.com/r/depression/comments/1ok6tix/feels_like_im_at_a_dead_end/,https://www.reddit.com/r/depression/comments/1ok6tix/feels_like_im_at_a_dead_end/,1761847119,True,"I’m 26. In the last two years I have went through a breakup, and moved three times. I now live back at home on my parents property in a travel trailer because my mom suggested that was the best idea. The travel trailer now has water damage and needs to be repaired so I will no longer have a place to live again. My car has started making a noise and I’m afraid it’s going to be something expensive. I’m in so much debt from buying the trailer, my card is maxed out, I have two loans from moving and ",,www.reddit.com,
I messed up the only relationship that i wanted,6,1.0,3,shairusiek,depression,https://www.reddit.com/r/depression/comments/1ojz03z/i_messed_up_the_only_relationship_that_i_wanted/,https://www.reddit.com/r/depression/comments/1ojz03z/i_messed_up_the_only_relationship_that_i_wanted/,1761829112,True,"I lost my girl, my light because of stupid actions, immaturity and poor emotional inteligence. 

We've broke up few times because of my impulsive actions and one time i even broke up with her on her bday.

Now i cant clear my mind, i cry all the day and its have been 3 weeks already. I still cant understand how i could mess it up that bad.",,www.reddit.com,
Memoria,2,1.0,1,Efficient_Egg_2141,depression,https://www.reddit.com/r/depression/comments/1ok6hg1/memoria/,https://www.reddit.com/r/depression/comments/1ok6hg1/memoria/,1761846372,True,"Para mí, posiblemente de lo más devastador fue la perdida de memoria porque se ha mantenido a lo largo de los años ",,www.reddit.com,
I don't really know what to do,2,1.0,1,Floof_Flaffid,depression,https://www.reddit.com/r/depression/comments/1ok6f49/i_dont_really_know_what_to_do/,https://www.reddit.com/r/depression/comments/1ok6f49/i_dont_really_know_what_to_do/,1761846227,True,"I'm 15 and I've been depressed for a really long time, not even for a particular reason I just have been. I've not actively wanted to live for years and it got to a breaking point with my mum and I completely snapped at her one day after she found out I haven't done any homework since the school year started and it got to a teary confession from me and I told her everything that's wrong. She heard me out and told me she's sorry and everything but literally nothing has changed except now she chas",,www.reddit.com,
How to pull yourself out of the depressive hole?,29,0.97,17,Witty_District1257,depression,https://www.reddit.com/r/depression/comments/1ojorsc/how_to_pull_yourself_out_of_the_depressive_hole/,https://www.reddit.com/r/depression/comments/1ojorsc/how_to_pull_yourself_out_of_the_depressive_hole/,1761793298,True,"I’ve been pretty deep with my depression lately. I’m drinking a bunch, can’t sleep, can’t relate, don’t really feel like a person. What do you do to feel like a person again? ",,www.reddit.com,
I want to die but I can’t,2,1.0,0,Straightupsimping,depression,https://www.reddit.com/r/depression/comments/1ok5vw2/i_want_to_die_but_i_cant/,https://www.reddit.com/r/depression/comments/1ok5vw2/i_want_to_die_but_i_cant/,1761845039,True,"I feel so alone and I’ve lost the motivation to do anything. I don’t change my clothes, I don’t shower, I don’t eat, and the things I once loved to do now feel like I’m doing nothing at all. The only reason I leave my house is to go to college because my mom says I have no choice but to have good grades, but I don’t even know what I want to do with my life. And it’s so fucking embarrassing crying in my classes every single day, but it’s like I have no control. I have absolutely no talents or the",,www.reddit.com,
I’m so tired of survival mode,3,1.0,0,Pigtails-83,depression,https://www.reddit.com/r/depression/comments/1ok0x8u/im_so_tired_of_survival_mode/,https://www.reddit.com/r/depression/comments/1ok0x8u/im_so_tired_of_survival_mode/,1761833784,True,"I know I wrote here yesterday, however today is just as bad. I feel lonely with my thoughts. I was so upset this morning that I all I could think about was the jump. I was on my way to go check out the building however I turned around. I feel like such a coward. I’m so tired. I’m tired of being told how terrible of a person I am, a fur parent I am, a friend, a wife, and even daughter. I’m so tired. I should just end it and yet I’m a coward. ",,www.reddit.com,
I feel like suiciding,9,1.0,2,No_Albatross7934,depression,https://www.reddit.com/r/depression/comments/1ojtis0/i_feel_like_suiciding/,https://www.reddit.com/r/depression/comments/1ojtis0/i_feel_like_suiciding/,1761810274,True,"A man suicides when he lacks love, one cannot live without love. Love is what keeps us alive, and everyone who has suicided so far lacked love at some point in their life.

I 29m never experienced love or intimacy by any female, I was rejected plenty of times, and it's so fucking painful. Many of my friends are married up until to this point, and I didn't even had dated anyone. 

I'm working daily like a robot, I've a fine job, and earning well, but it's painful. All I do is work, work and work ",,www.reddit.com,
This hurts so much I’m reaching my limit,16,1.0,6,usernamesaredumb3,depression,https://www.reddit.com/r/depression/comments/1ojq8of/this_hurts_so_much_im_reaching_my_limit/,https://www.reddit.com/r/depression/comments/1ojq8of/this_hurts_so_much_im_reaching_my_limit/,1761797870,True,"I’m lonely. I’m tired all the time. I hate everything I used to love. It’s cold out and I love wearing sweaters but I hate how short the days are becoming again. 

It hurts it hurts it hurts it hurts. 

Does anyone know what it’s like to feel this level of pain, this deep longing for happiness, this level of unrelenting agony and loneliness, and have all that pain, all those emotions, feel nostalgic? This pain feels like home. It’s my childhood. I haven’t felt this way since I was in 2nd grade. ",,www.reddit.com,
when you genuinely have nothing to live for,145,1.0,23,marc1lle,depression,https://www.reddit.com/r/depression/comments/1oj8lcb/when_you_genuinely_have_nothing_to_live_for/,https://www.reddit.com/r/depression/comments/1oj8lcb/when_you_genuinely_have_nothing_to_live_for/,1761753971,True,"what are you supposed to do when your life is quite literally pointless. when you have nothing. i don’t have close friends. i don’t have a captivating personality. i don’t have people who want to be around me, because im a horrible miserable person. i don’t have a loving supportive family. no money. i’m not good at anything, not at school or hobbies, but that doesn’t matter because even things i enjoy have turned into a chore that i don’t want to do. i just have me. and that’s not enough to keep",,www.reddit.com,
